<?xml version="1.0" encoding="UTF-8"?>
<clientes xmlns:xsi="http://www.w3.org/2001/XMLSchema-instance"
    xsi:noNamespaceSchemaLocation="clientesReal.xsd">
    <sede codigo="T45678XV">
        <direccion>Calle Avenida de Epa√±a 82</direccion>
        <direccion>Calle San Ignacio 23-C</direccion>
        <nombreEmpleado>Serigo Mateos Puerta</nombreEmpleado>
        <fechaAlta>2021-01-01T00:00:00</fechaAlta>
        <descripcionCliente>Solvente</descripcionCliente>
        <cliente codigo="THB-123">
            <vivienda>
                <numViviendas numero="1"></numViviendas>
                <costeVivienda>139656</costeVivienda>
                <numHabitaciones>5</numHabitaciones>
                <resumenViviendas>Vacia</resumenViviendas>
                <plazoAlta>2022-01-14</plazoAlta>
            </vivienda>
        </cliente>
    </sede>
    <sede codigo="P47923YU">
        <direccion>Direccion de la sede</direccion>
        <nombreEmpleado>Antoni Juan Rios</nombreEmpleado>
        <fechaAlta>2022-01-21T14:30:00</fechaAlta>
        <descripcionCliente>Insolvente</descripcionCliente>
        <cliente codigo="THB-123">
            <vivienda>
                <numViviendas numero="1"></numViviendas>
                <costeVivienda>139656</costeVivienda>
                <numHabitaciones>5</numHabitaciones>
                <resumenViviendas>Vacia</resumenViviendas>
                <plazoAlta>2022-01-14</plazoAlta>
            </vivienda>
            <vivienda>
                <numViviendas numero="2"></numViviendas>
                <costeVivienda>16395</costeVivienda>
                <numHabitaciones>2</numHabitaciones>
                <resumenViviendas>En buen estado</resumenViviendas>
                <plazoAlta>2021-03-18</plazoAlta>
            </vivienda>
        </cliente>
    </sede>
</clientes>